{
  "schemaVersion": 1,
  "candidateTerm": "Voice Cloning",
  "proposalHash": "sha256:9685216228988afbcba2d89d9af847e2b1fe4d2d89958699431ab5c1831340fb",
  "evidenceHash": "sha256:ecfd1fd17bf74c351ad9eb117674be563f5d506fa40954a698a2511b4b6f5b96",
  "assessmentHash": "sha256:d43093c7b2b78c6fed30b7027f1d4ebe5337b2b03165eca3e9ba35e859b567ee",
  "createdAt": "2026-07-24",
  "node": {
    "aliases": [
      "Voice Cloning",
      "语音克隆",
      "音色克隆",
      "Voice Clone",
      "Zero-shot Voice Cloning"
    ],
    "maturity": "evolving",
    "heat": 0.76,
    "body": "**是什么**：声音克隆是目标说话人条件化的语音合成：除了“说什么”，系统还从一段参考录音中获得“像谁说”，再生成该说话人未录过的新语句。它建立在 [[speech]] 上，但多出独立的身份条件与评测轴。\n\n**机制**：即时或零样本克隆在推理时把参考音频压成 speaker embedding，或直接把声学 codec token 当作提示；专业克隆则用更长的目标语音做 [[fine-tuning]]。两条路线最终都把文本内容和说话人条件送入合成器，再由声学解码器生成波形，因此属于 [[controllable-generation]]。\n\n**约束与影响**：可懂度、自然度和说话人相似度是不同目标；参考音频里的噪声、混响、口音与情绪也可能被复制。声音是可识别的生物特征，未经授权的克隆会威胁 [[privacy]]，还可用于身份冒用。\n\n**怎么应对**：用独立测试集分别测 WER、主观自然度和说话人相似度；在采集前确认权利与同意，生成时保留来源记录，发布后结合水印、溯源与 [[content-detection]]。检测器有误报和漏报，不能替代授权。",
    "cases": [
      {
        "title": "即时克隆：少量参考音频快速生成",
        "text": "用户提交一至数分钟干净、单人、风格一致的录音。系统不为该人训练专属模型，而是在推理时提取说话人表示，并把它作为新文本合成的条件。速度快，但特殊口音、强情绪和跨语言稳定性可能较弱。"
      },
      {
        "title": "专业克隆：用较长语料做目标适配",
        "text": "经授权收集更长且覆盖充分的目标语音，清洗、切分并用于参数适配。它可能提高跨文本和长段落的一致性，但也会把数据中的房间声、表演风格和发音偏差学得更牢，需要留出独立测试语句。"
      },
      {
        "title": "内容修补与风险控制",
        "text": "创作者可用自己的授权克隆补录漏句、制作多语言版本。上线前应确认生成文本、说话人身份和用途都在授权范围内；高风险场景还要披露合成属性、保存审计记录并防止把克隆音频当作身份认证凭据。"
      }
    ],
    "sources": [
      {
        "type": "url",
        "title": "SV2TTS：从说话人验证迁移到多说话人语音合成",
        "ref": "https://arxiv.org/abs/1806.04558"
      },
      {
        "type": "url",
        "title": "VALL-E：以声学提示进行零样本语音合成",
        "ref": "https://arxiv.org/abs/2301.02111"
      },
      {
        "type": "url",
        "title": "ElevenLabs Voice Cloning 技术说明",
        "ref": "https://elevenlabs.io/docs/eleven-api/concepts/voice-cloning"
      },
      {
        "type": "url",
        "title": "FTC Voice Cloning Challenge",
        "ref": "https://www.ftc.gov/news-events/contests/ftc-voice-cloning-challenge"
      },
      {
        "type": "url",
        "title": "ASVspoof 2021 Evaluation Plan",
        "ref": "https://www.asvspoof.org/asvspoof2021/asvspoof2021_evaluation_plan.pdf"
      }
    ]
  },
  "deepDive": {
    "title": "声音克隆",
    "subtitle": "把“说什么”和“像谁说”拆成两种条件，再用可懂度、自然度、身份相似度与授权共同验收",
    "aliases": "Voice Cloning · 语音克隆 · 音色克隆 · Zero-shot Voice Cloning",
    "meta": "多模态生成系统 · 演进中 · 约 18 分钟",
    "thesis": "声音克隆不是把一段录音复制粘贴，也不是只让 TTS 更自然；它从参考语音提取目标说话人条件，让系统用该身份生成未出现过的新内容。真正可用的闭环必须同时控制内容、身份、声学质量和授权边界。",
    "html": "<div class=\"dd-goals\"><div class=\"dd-goals-h\">读完这一页，你应该能自己回答：</div><ul><li>声音克隆比普通文本转语音多了什么输入和独立目标？</li><li>speaker embedding 路线与 acoustic prompt 路线怎样让未见说话人参与推理？</li><li>即时克隆与专业克隆为何不是单纯的快慢差别？</li><li>怎样用同一组样本分别验证可懂度、自然度和身份相似度？</li><li>为什么相似度很高仍不代表系统可合法、安全地发布？</li></ul></div>\n<section class=\"dd-sec\"><h2><span class=\"dd-n\">1</span>问题定义：一句话包含两类信息<span class=\"dd-badge intuition\">直觉</span></h2><p class=\"dd-lead\">如果文本已经规定了要说什么，参考录音究竟还提供了什么？</p><p>普通文本转语音接收文本或音素序列，目标是产生可懂、自然的波形；声音克隆还接收目标说话人的参考语音。参考语音不是要被逐字复述的内容，而是用来估计身份相关条件：音色、共振峰结构、发音习惯、口音，以及可能混入的韵律和录音环境。于是一次生成可写成 <b>文本内容 c + 说话人条件 s → 声学表示 a → 波形 x</b>。</p><p>关键拆分是“说什么”与“像谁说”。同一段文本可与不同说话人条件组合；同一个说话人条件也应覆盖从未录过的新文本。若系统只能回放原句，或只在训练语句上听起来相似，它完成的是检索、剪贴或记忆，不是具有泛化能力的声音克隆。</p><div class=\"dd-note warn\"><b>身份相似不等于逐项复制。</b>参考录音同时包含话筒、房间、情绪和背景声；模型可能把这些偶然因素当成身份特征。工程目标必须说明希望保留什么、希望抑制什么。</div></section>\n<section class=\"dd-sec\"><h2><span class=\"dd-n\">2</span>输入先被分成内容与身份<span class=\"dd-badge math\">表示</span></h2><p class=\"dd-lead\">模型如何避免把参考录音里的原句误当成要生成的新内容？</p><p>一类系统先用说话人编码器把若干参考片段压缩成固定长度向量 e<sub>spk</sub>。编码器通常从说话人验证任务学到：同一人的不同句子靠近，不同人的表示分开。合成器接收新文本表示 h<sub>text</sub> 与 e<sub>spk</sub>，预测梅尔谱或其他声学表示；vocoder 再把它还原为波形。参考句子的词序不应直接成为输出内容。</p><div class=\"dd-formula\">e<sub>spk</sub> = Enc<sub>speaker</sub>(x<sub>ref</sub>)，　a = Synth(h<sub>text</sub>, e<sub>spk</sub>)，　x̂ = Vocoder(a)</div><p>另一类 neural codec 语言模型不强制把身份压成单个向量，而把参考音频离散为声学 token 前缀。模型在文本或音素条件下继续生成后续 token，再由 codec 解码器恢复声音。前缀能保留更丰富的声学细节，却也更容易携带参考录音的噪声、韵律和设备特征。</p><div class=\"dd-table-wrap\"><table class=\"dd-table\"><thead><tr><th>表示路线</th><th>参考音频变成什么</th><th>优势</th><th>主要边界</th></tr></thead><tbody><tr><td>Speaker embedding</td><td>固定长度身份向量</td><td>可复用、易比较、便于多片段聚合</td><td>压缩可能丢失细腻风格，或混入数据偏差</td></tr><tr><td>Acoustic prompt</td><td>一串 codec 声学 token</td><td>保留局部音色、韵律与录音细节</td><td>提示中的内容、噪声和风格可能被续写</td></tr></tbody></table></div></section>\n<section class=\"dd-sec\"><h2><span class=\"dd-n\">3</span>零样本克隆：适配发生在推理时<span class=\"dd-badge eng\">机制</span></h2><p class=\"dd-lead\">为什么几秒参考语音就可能让一个训练时没见过的人“进入”模型？</p><p>多说话人模型先在大量说话人与文本上学习共同的语音规律，把发音内容和说话人差异尽量分开。遇到新说话人时，它不更新该人的专属权重，而是从参考音频即时计算条件；新文本在同一次推理中与这个条件结合。因此“零样本”指目标说话人没有参与模型训练，不等于系统没有训练，也不等于零参考音频。</p><p>这条路线的泛化依赖训练分布。若目标口音、年龄、语言、发声方式或录音设备远离训练数据，编码器可能无法稳定抽取身份。增加同一说话人的多段干净参考能降低偶然噪声，却不能保证模型具备从未学过的语言和表现力。</p><figure class=\"dd-fig\"><svg viewBox=\"0 0 760 285\" role=\"img\" aria-label=\"声音克隆从文本与参考录音到生成、评测和反馈的闭环\"><defs><marker id=\"vcArrow\" markerWidth=\"8\" markerHeight=\"8\" refX=\"6\" refY=\"3\" orient=\"auto\"><path d=\"M0,0 L6,3 L0,6 z\" fill=\"#748094\"/></marker></defs><rect x=\"18\" y=\"38\" width=\"126\" height=\"68\" rx=\"9\" fill=\"#21252d\" stroke=\"#6b8cbe\"/><text x=\"81\" y=\"65\" text-anchor=\"middle\" class=\"svg-t\">新文本</text><text x=\"81\" y=\"86\" text-anchor=\"middle\" class=\"svg-t\" font-size=\"10\">内容条件 c</text><rect x=\"18\" y=\"156\" width=\"126\" height=\"68\" rx=\"9\" fill=\"#21252d\" stroke=\"#d3a05a\"/><text x=\"81\" y=\"183\" text-anchor=\"middle\" class=\"svg-t\">授权参考录音</text><text x=\"81\" y=\"204\" text-anchor=\"middle\" class=\"svg-t\" font-size=\"10\">身份条件 s</text><path d=\"M144,72 L230,114\" stroke=\"#748094\" marker-end=\"url(#vcArrow)\"/><path d=\"M144,190 L230,148\" stroke=\"#748094\" marker-end=\"url(#vcArrow)\"/><rect x=\"232\" y=\"93\" width=\"146\" height=\"88\" rx=\"9\" fill=\"#21252d\" stroke=\"#9b7cc1\"/><text x=\"305\" y=\"120\" text-anchor=\"middle\" class=\"svg-t\">条件化合成器</text><text x=\"305\" y=\"143\" text-anchor=\"middle\" class=\"svg-t\" font-size=\"10\">embedding 或 acoustic prompt</text><text x=\"305\" y=\"163\" text-anchor=\"middle\" class=\"svg-t\" font-size=\"10\">→ 声学 token / 频谱</text><path d=\"M378,137 L429,137\" stroke=\"#748094\" marker-end=\"url(#vcArrow)\"/><rect x=\"431\" y=\"93\" width=\"116\" height=\"88\" rx=\"9\" fill=\"#21252d\" stroke=\"#4f9d78\"/><text x=\"489\" y=\"121\" text-anchor=\"middle\" class=\"svg-t\">声学解码</text><text x=\"489\" y=\"145\" text-anchor=\"middle\" class=\"svg-t\" font-size=\"10\">vocoder / codec</text><text x=\"489\" y=\"165\" text-anchor=\"middle\" class=\"svg-t\" font-size=\"10\">→ 波形 x̂</text><path d=\"M547,137 L598,137\" stroke=\"#748094\" marker-end=\"url(#vcArrow)\"/><rect x=\"600\" y=\"58\" width=\"142\" height=\"158\" rx=\"9\" fill=\"#21252d\" stroke=\"#c77b72\"/><text x=\"671\" y=\"84\" text-anchor=\"middle\" class=\"svg-t\">独立验收</text><text x=\"671\" y=\"108\" text-anchor=\"middle\" class=\"svg-t\" font-size=\"10\">内容：WER</text><text x=\"671\" y=\"129\" text-anchor=\"middle\" class=\"svg-t\" font-size=\"10\">质量：MOS</text><text x=\"671\" y=\"150\" text-anchor=\"middle\" class=\"svg-t\" font-size=\"10\">身份：相似度 / EER</text><text x=\"671\" y=\"171\" text-anchor=\"middle\" class=\"svg-t\" font-size=\"10\">治理：授权 / 溯源</text><text x=\"671\" y=\"192\" text-anchor=\"middle\" class=\"svg-t\" font-size=\"10\">失败 → 数据或策略反馈</text><path d=\"M671,217 C668,267 102,274 81,226\" fill=\"none\" stroke=\"#748094\" marker-end=\"url(#vcArrow)\"/><figcaption>图 1　声音克隆闭环：生成只是中段；参考数据、四类验收信号与失败反馈共同决定能否发布。</figcaption></figure></section>\n<section class=\"dd-sec\"><h2><span class=\"dd-n\">4</span>专业克隆：参数适配不是“多等一会儿”<span class=\"dd-badge eng\">训练</span></h2><p class=\"dd-lead\">即时克隆与专业克隆的本质差异，为什么不只是处理时间？</p><p>即时克隆在已有模型上计算临时条件，目标说话人的信息主要停留在本次输入或保存的表示中。专业克隆则用较长、经授权的目标语料继续训练或适配部分参数，使模型权重更稳定地表达该说话人的规律。它可能改善长文本一致性、独特口音与细微音色，但同时提高数据、训练、删除和权限管理成本。</p><p>适配并非自动优于零样本。训练集若全是激昂广告语，模型可能把“激昂”错误绑定为身份；若每段都来自同一混响房间，它可能复制房间声；若训练文本覆盖窄，模型对未见音素组合仍会失败。应把说话人、文本覆盖、风格与环境分别建模，并保留从未参与适配的测试句。</p><div class=\"dd-table-wrap\"><table class=\"dd-table\"><thead><tr><th>维度</th><th>即时/零样本克隆</th><th>专业/适配式克隆</th></tr></thead><tbody><tr><td>目标身份进入系统的位置</td><td>推理时 embedding 或声学提示</td><td>目标数据驱动参数更新，推理时仍可带条件</td></tr><tr><td>典型数据量</td><td>数秒到数分钟</td><td>数十分钟到数小时，取决于系统</td></tr><tr><td>主要优势</td><td>快、试错成本低</td><td>跨文本和长段落一致性可能更高</td></tr><tr><td>主要风险</td><td>对噪声、口音和短样本敏感</td><td>过拟合风格、删除困难、训练数据治理更重</td></tr><tr><td>失败时先查</td><td>参考片段、分布外输入、条件强度</td><td>数据覆盖、切分、训练/验证泄漏、过拟合</td></tr></tbody></table></div></section>\n<section class=\"dd-sec\"><h2><span class=\"dd-n\">5</span>贯穿手算：高相似不代表文字正确<span class=\"dd-badge math\">完整示例</span></h2><p class=\"dd-lead\">怎样用一组可复现数字证明“像本人”和“说对了”是两件事？</p><p>假设参考说话人的归一化二维表示为 e<sub>ref</sub>=[0.8, 0.6]，生成语音得到 e<sub>gen</sub>=[0.6, 0.8]。二者范数都为 1，余弦相似度是 (0.8×0.6+0.6×0.8)=<b>0.96</b>。若另一位说话人的表示 e<sub>other</sub>=[−0.8, 0.6]，与参考的相似度为 −0.64+0.36=<b>−0.28</b>。在这个玩具空间里，生成结果明显更像目标说话人。</p><div class=\"dd-formula\">cos(e<sub>ref</sub>,e<sub>gen</sub>) = (e<sub>ref</sub>·e<sub>gen</sub>)/(‖e<sub>ref</sub>‖‖e<sub>gen</sub>‖) = 0.96</div><p>再检查内容。目标分词是“请 / 在 / 下午 / 三点 / 播报 / 天气”，ASR 转写却是“请 / 在 / 下午 / 三点 / 播放 / 天气”。最少编辑包含 1 次替换、参考词数 N=6，所以 WER=(S+D+I)/N=1/6≈<b>16.7%</b>。结论是：它很像本人，但关键动词说错了。反过来，一个普通 TTS 可能 WER=0，却完全不像目标说话人。</p><div class=\"dd-note\"><b>复现实验：</b>固定 20 条未参与训练的句子与同一说话人验证模型，对两个系统分别记录 WER 和 cosine；不要用训练片段或肉耳挑选的“最好样本”。再由盲听者评分自然度和身份相似度，三轴分开报告。</div></section>\n<section class=\"dd-sec\"><h2><span class=\"dd-n\">6</span>三轴评测：内容、质量、身份不可互相替代<span class=\"dd-badge eng\">验证</span></h2><p class=\"dd-lead\">为什么一个总分会掩盖声音克隆最危险的失败？</p><p><b>可懂度</b>关注内容是否正确，可用 WER/CER 和人工校对；<b>自然度</b>关注是否像流畅真人语音，常用盲听 MOS 或成对偏好；<b>说话人保持</b>关注是否像目标身份，可用盲听相似度、说话人嵌入余弦相似度或验证系统 EER。三个指标的优化方向相关但不等价。</p><div class=\"dd-table-wrap\"><table class=\"dd-table\"><thead><tr><th>观察信号</th